asin,title,link,current_rank,category_url,days_seen,first_seen,keywords,idea_prompt
B09RN3PR2F,Official Justin Bieber Black T-Shirt Small,https://www.amazon.com/Official-Justin-Bieber-Black-T-Shirt/dp/B09RN3PR2F/ref=zg_bs_g_9056987011_d_sccl_17/133-9175406-2191550,17,https://www.amazon.com/Best-Sellers-Men%27s-Novelty-T-Shirts/zgbs/fashion/9056987011,1,2026-04-11T06:44:31.606529Z,"justin, bieber, black, small","Create an original, text-forward T-shirt design around: justin, bieber, black, small. Use clear fonts and simple iconography. Avoid trademarks."
B08JHGWRFS,INTO THE AM Men's Graphic T-Shirts S - 4XL Premium Short Sleeve Tees Cool Nature Designs,https://www.amazon.com/INTO-AM-Thorn-Grip-Mens/dp/B08JHGWRFS/ref=zg_bs_g_9056987011_d_sccl_21/133-9175406-2191550,21,https://www.amazon.com/Best-Sellers-Men%27s-Novelty-T-Shirts/zgbs/fashion/9056987011,1,2026-04-11T06:44:31.606529Z,"into, shirts, 4xl, premium, tees, nature, designs","Create an original, text-forward T-shirt design around: into, shirts, 4xl, premium, tees, nature, designs. Use clear fonts and simple iconography. Avoid trademarks."
B09ZJ94PDH,Funny T Shirts for Men Food Joke Tees for Guys with Funny Sayings Sarcastic Graphic T Shirts,https://www.amazon.com/Crazy-Dog-T-Shirts-Synonym-Cinnamon/dp/B09ZJ94PDH/ref=zg_bs_g_9056987011_d_sccl_23/133-9175406-2191550,23,https://www.amazon.com/Best-Sellers-Men%27s-Novelty-T-Shirts/zgbs/fashion/9056987011,1,2026-04-11T06:44:31.606529Z,"shirts, food, joke, tees, guys, sayings, sarcastic","Create an original, text-forward T-shirt design around: shirts, food, joke, tees, guys, sayings, sarcastic. Use clear fonts and simple iconography. Avoid trademarks."
B07J9JZBLN,Michael Jackson 'Thriller' T-Shirt,https://www.amazon.com/Michael-Jackson-Thriller-T-Shirt-Large/dp/B07J9JZBLN/ref=zg_bs_g_9056987011_d_sccl_27/133-9175406-2191550,27,https://www.amazon.com/Best-Sellers-Men%27s-Novelty-T-Shirts/zgbs/fashion/9056987011,1,2026-04-11T06:44:31.606529Z,"michael, jackson, 'thriller'","Create an original, text-forward T-shirt design around: michael, jackson, 'thriller'. Use clear fonts and simple iconography. Avoid trademarks."
B0CLYLY41K,Mens Later Alligator T Shirt Funny Gator Joke Saying Tee for Guys,https://www.amazon.com/Alligator-Saying-Sarcastic-Apparel-Novelty/dp/B0CLYLY41K/ref=zg_bs_g_9056987011_d_sccl_30/133-9175406-2191550,30,https://www.amazon.com/Best-Sellers-Men%27s-Novelty-T-Shirts/zgbs/fashion/9056987011,1,2026-04-11T06:44:31.606529Z,"mens, later, alligator, gator, joke, saying, guys","Create an original, text-forward T-shirt design around: mens, later, alligator, gator, joke, saying, guys. Use clear fonts and simple iconography. Avoid trademarks."
