asin,title,link,current_rank,category_url,days_seen,first_seen,keywords,idea_prompt
B0BJZ9GT1J,"True Classic Mens T-Shirts – Short Sleeve Crew Neck T Shirts for Man, Cotton Blend Plain Novelty Men's T-Shirts",https://www.amazon.com/True-Classic-Staple-6-Pack-X-Large/dp/B0BJZ9GT1J/ref=zg_bs_g_9056987011_d_sccl_1/134-5738087-2925330,1,https://www.amazon.com/Best-Sellers-Men%27s-Novelty-T-Shirts/zgbs/fashion/9056987011,1,2026-01-08T06:16:13.559789Z,"true, mens, shirts, crew, neck, man, cotton, blend, plain","Create an original, text-forward T-shirt design around: true, mens, shirts, crew, neck, man, cotton, blend, plain. Use clear fonts and simple iconography. Avoid trademarks."
B0CKHN9XM4,"NAZENTI Custom Bootleg Rap Tee, Custom T-Shirts with Picture, Retro Custom Bootleg, Valentine's Gifts for Him Her",https://www.amazon.com/Bootleg-Vintage-T-Shirts-Customa-Birthday/dp/B0CKHN9XM4/ref=zg_bs_g_9056987011_d_sccl_23/134-5738087-2925330,23,https://www.amazon.com/Best-Sellers-Men%27s-Novelty-T-Shirts/zgbs/fashion/9056987011,1,2026-01-08T06:16:13.559789Z,"nazenti, custom, bootleg, rap, shirts, picture, valentine's, gifts, him, her","Create an original, text-forward T-shirt design around: nazenti, custom, bootleg, rap, shirts, picture, valentine's, gifts, him, her. Use clear fonts and simple iconography. Avoid trademarks."
B0F851L627,"Funny Sarcastic Saying Tee Shirts for Men - Husband, Dad, Grandpa, Boyfriend Son Humor Joke T-Shirts",https://www.amazon.com/Please-Be-Patient-1900s-Sarcastic/dp/B0F851L627/ref=zg_bs_g_9056987011_d_sccl_24/134-5738087-2925330,24,https://www.amazon.com/Best-Sellers-Men%27s-Novelty-T-Shirts/zgbs/fashion/9056987011,1,2026-01-08T06:16:13.559789Z,"sarcastic, saying, shirts, husband, dad, grandpa, boyfriend, son, humor, joke","Create an original, text-forward T-shirt design around: sarcastic, saying, shirts, husband, dad, grandpa, boyfriend, son, humor, joke. Use clear fonts and simple iconography. Avoid trademarks."
B0FTGQ4QF9,Stranger Things Season 5 Retro Video Game Character Select T-Shirt,https://www.amazon.com/Stranger-Things-Season-Character-T-Shirt/dp/B0FTGQ4QF9/ref=zg_bs_g_9056987011_d_sccl_28/134-5738087-2925330,28,https://www.amazon.com/Best-Sellers-Men%27s-Novelty-T-Shirts/zgbs/fashion/9056987011,1,2026-01-08T06:16:13.559789Z,"stranger, things, season, video, game, character, select","Create an original, text-forward T-shirt design around: stranger, things, season, video, game, character, select. Use clear fonts and simple iconography. Avoid trademarks."
B09NKLPNTS,Goodstoworld Unisex 3D Fake Abs T Shirts Shredded Chest Printed Short Sleeve Costume Novelty Tees Shirt,https://www.amazon.com/Goodstoworld-Muscle-Sleeve-Printed-Clothing/dp/B09NKLPNTS/ref=zg_bs_g_9056987011_d_sccl_29/134-5738087-2925330,29,https://www.amazon.com/Best-Sellers-Men%27s-Novelty-T-Shirts/zgbs/fashion/9056987011,1,2026-01-08T06:16:13.559789Z,"goodstoworld, unisex, fake, abs, shirts, shredded, chest, printed, costume, tees","Create an original, text-forward T-shirt design around: goodstoworld, unisex, fake, abs, shirts, shredded, chest, printed, costume, tees. Use clear fonts and simple iconography. Avoid trademarks."
