asin,title,link,current_rank,category_url,days_seen,first_seen,keywords,idea_prompt
B0C958ZQ1L,INTO THE AM Graphic Tees for Men S - 4XL Premium Short Sleeve Colorful T-Shirts Trippy Space Designs,https://www.amazon.com/INTO-AM-Tranquil-Ascent-Tshirt/dp/B0C958ZQ1L/ref=zg_bs_g_9056987011_d_sccl_8/141-4706112-9633613,8,https://www.amazon.com/Best-Sellers-Men%27s-Novelty-T-Shirts/zgbs/fashion/9056987011,1,2026-04-09T07:06:12.617371Z,"into, tees, 4xl, premium, colorful, shirts, trippy, space, designs","Create an original, text-forward T-shirt design around: into, tees, 4xl, premium, colorful, shirts, trippy, space, designs. Use clear fonts and simple iconography. Avoid trademarks."
B085QXXLSR,Pimento Cheese Golf Dad T-Shirt,https://www.amazon.com/Pimento-Cheese-Golf-Dad-T-Shirt/dp/B085QXXLSR/ref=zg_bs_g_9056987011_d_sccl_23/141-4706112-9633613,23,https://www.amazon.com/Best-Sellers-Men%27s-Novelty-T-Shirts/zgbs/fashion/9056987011,1,2026-04-09T07:06:12.617371Z,"pimento, cheese, golf, dad","Create an original, text-forward T-shirt design around: pimento, cheese, golf, dad. Use clear fonts and simple iconography. Avoid trademarks."
B0GCHCF1WT,Kpop Demon Hunters Birthday Girl Adorable Chibi Group Shot T-Shirt,https://www.amazon.com/Demon-Hunters-Birthday-Adorable-T-Shirt/dp/B0GCHCF1WT/ref=zg_bs_g_9056987011_d_sccl_24/141-4706112-9633613,24,https://www.amazon.com/Best-Sellers-Men%27s-Novelty-T-Shirts/zgbs/fashion/9056987011,1,2026-04-09T07:06:12.617371Z,"kpop, demon, hunters, birthday, girl, adorable, chibi, group, shot","Create an original, text-forward T-shirt design around: kpop, demon, hunters, birthday, girl, adorable, chibi, group, shot. Use clear fonts and simple iconography. Avoid trademarks."
B07XKWP47R,"Customized T-Shirt, Upload Photos, Type Text, Custom Gifts, Personalized with Your Own Design",https://www.amazon.com/Customized-T-Shirt-Upload-Photos-Personalized/dp/B07XKWP47R/ref=zg_bs_g_9056987011_d_sccl_27/141-4706112-9633613,27,https://www.amazon.com/Best-Sellers-Men%27s-Novelty-T-Shirts/zgbs/fashion/9056987011,1,2026-04-09T07:06:12.617371Z,"customized, upload, photos, type, text, custom, gifts, personalized, your, own, design","Create an original, text-forward T-shirt design around: customized, upload, photos, type, text, custom, gifts, personalized, your, own, design. Use clear fonts and simple iconography. Avoid trademarks."
B09XWKQNMC,Grunt Style American Acid Men's T-Shirt,https://www.amazon.com/Grunt-Style-American-T-Shirt-XLarge/dp/B09XWKQNMC/ref=zg_bs_g_9056987011_d_sccl_28/141-4706112-9633613,28,https://www.amazon.com/Best-Sellers-Men%27s-Novelty-T-Shirts/zgbs/fashion/9056987011,1,2026-04-09T07:06:12.617371Z,"grunt, style, american, acid","Create an original, text-forward T-shirt design around: grunt, style, american, acid. Use clear fonts and simple iconography. Avoid trademarks."
B08JRX28CS,Disney Mickey & Friends Mickey Mouse Vintage Portrait T-Shirt,https://www.amazon.com/Disney-Friends-Vintage-Portrait-T-Shirt/dp/B08JRX28CS/ref=zg_bs_g_9056987011_d_sccl_29/141-4706112-9633613,29,https://www.amazon.com/Best-Sellers-Men%27s-Novelty-T-Shirts/zgbs/fashion/9056987011,1,2026-04-09T07:06:12.617371Z,"disney, mickey, friends, mouse, portrait","Create an original, text-forward T-shirt design around: disney, mickey, friends, mouse, portrait. Use clear fonts and simple iconography. Avoid trademarks."
B0D44RNRYH,"The King of Pop Michael Jackson MJ-002 Black Cotton 100% T-Shirt, Unisex-Adults, Small, Short Sleeve",https://www.amazon.com/The-king-of-pop-MJ-002/dp/B0D44RNRYH/ref=zg_bs_g_9056987011_d_sccl_30/141-4706112-9633613,30,https://www.amazon.com/Best-Sellers-Men%27s-Novelty-T-Shirts/zgbs/fashion/9056987011,1,2026-04-09T07:06:12.617371Z,"king, pop, michael, jackson, 002, black, cotton, 100, unisex, adults, small","Create an original, text-forward T-shirt design around: king, pop, michael, jackson, 002, black, cotton, 100, unisex, adults, small. Use clear fonts and simple iconography. Avoid trademarks."
