asin,title,link,current_rank,category_url,days_seen,first_seen,keywords,idea_prompt
B09TQ1N4FX,Mens Saint Patricks Day T Shirts Funny St Pattys Tees for Partying Parade Tee for Guys,https://www.amazon.com/Distressed-Patricks-Crazy-Dog-T-Shirts/dp/B09TQ1N4FX/ref=zg_bs_g_9056987011_d_sccl_6/134-0223989-8979526,6,https://www.amazon.com/Best-Sellers-Men%27s-Novelty-T-Shirts/zgbs/fashion/9056987011,1,2026-03-08T06:26:51.964515Z,"mens, saint, patricks, day, shirts, pattys, tees, partying, parade, guys","Create an original, text-forward T-shirt design around: mens, saint, patricks, day, shirts, pattys, tees, partying, parade, guys. Use clear fonts and simple iconography. Avoid trademarks."
B07N125491,Funny Saint Patricks Day T Shirts for Men Party Shirts for St Pats Funny Drinking Tees,https://www.amazon.com/Crazy-Dog-T-Shirts-Funny-Patricks/dp/B07N125491/ref=zg_bs_g_9056987011_d_sccl_11/134-0223989-8979526,11,https://www.amazon.com/Best-Sellers-Men%27s-Novelty-T-Shirts/zgbs/fashion/9056987011,1,2026-03-08T06:26:51.964515Z,"saint, patricks, day, shirts, party, pats, drinking, tees","Create an original, text-forward T-shirt design around: saint, patricks, day, shirts, party, pats, drinking, tees. Use clear fonts and simple iconography. Avoid trademarks."
B01MYFYQX8,World's Tallest Leprechaun St Patricks Day T Shirt | Irish Pride St Patty's Day Shirts | Graphic T Shirts for Men & Women,https://www.amazon.com/Feelin-Good-Tees-Leprechaun-Patricks/dp/B01MYFYQX8/ref=zg_bs_g_9056987011_d_sccl_12/134-0223989-8979526,12,https://www.amazon.com/Best-Sellers-Men%27s-Novelty-T-Shirts/zgbs/fashion/9056987011,1,2026-03-08T06:26:51.964515Z,"world's, tallest, leprechaun, patricks, day, irish, pride, patty's, shirts, women","Create an original, text-forward T-shirt design around: world's, tallest, leprechaun, patricks, day, irish, pride, patty's, shirts, women. Use clear fonts and simple iconography. Avoid trademarks."
B07NPRNLRB,Mens I Always Carry A Little Pot with Me T Shirt Funny Saint Patricks Day Patty,https://www.amazon.com/Always-Little-Patricks-Apparel-Novelty/dp/B07NPRNLRB/ref=zg_bs_g_9056987011_d_sccl_20/134-0223989-8979526,20,https://www.amazon.com/Best-Sellers-Men%27s-Novelty-T-Shirts/zgbs/fashion/9056987011,1,2026-03-08T06:26:51.964515Z,"mens, always, carry, little, pot, saint, patricks, day, patty","Create an original, text-forward T-shirt design around: mens, always, carry, little, pot, saint, patricks, day, patty. Use clear fonts and simple iconography. Avoid trademarks."
B08X3Q9L85,Prone to Shenanigans & Malarkey Fun Clovers St Patrick's Day T-Shirt Small,https://www.amazon.com/Shenanigans-Malarkey-Clovers-Patricks-Day/dp/B08X3Q9L85/ref=zg_bs_g_9056987011_d_sccl_24/134-0223989-8979526,24,https://www.amazon.com/Best-Sellers-Men%27s-Novelty-T-Shirts/zgbs/fashion/9056987011,1,2026-03-08T06:26:51.964515Z,"prone, shenanigans, malarkey, fun, clovers, patrick's, day, small","Create an original, text-forward T-shirt design around: prone, shenanigans, malarkey, fun, clovers, patrick's, day, small. Use clear fonts and simple iconography. Avoid trademarks."
B0CCWZ8GVF,INTO THE AM Cool Graphic T-Shirts for Men S - 4XL Premium Quality Unique Graphic Art Tees,https://www.amazon.com/INTO-AM-Graphic-Trippy-Printed/dp/B0CCWZ8GVF/ref=zg_bs_g_9056987011_d_sccl_27/134-0223989-8979526,27,https://www.amazon.com/Best-Sellers-Men%27s-Novelty-T-Shirts/zgbs/fashion/9056987011,1,2026-03-08T06:26:51.964515Z,"into, shirts, 4xl, premium, quality, unique, art, tees","Create an original, text-forward T-shirt design around: into, shirts, 4xl, premium, quality, unique, art, tees. Use clear fonts and simple iconography. Avoid trademarks."
B083HYJ56M,St Patricks Day T Shirt Men Shamrock Tee St Paddys Day Irish Shirts Holiday Clover Short Sleeve Tops Tee,https://www.amazon.com/Distressed-Green-Clover-T-Shirt-Patricks/dp/B083HYJ56M/ref=zg_bs_g_9056987011_d_sccl_28/134-0223989-8979526,28,https://www.amazon.com/Best-Sellers-Men%27s-Novelty-T-Shirts/zgbs/fashion/9056987011,1,2026-03-08T06:26:51.964515Z,"patricks, day, shamrock, paddys, irish, shirts, holiday, clover, tops","Create an original, text-forward T-shirt design around: patricks, day, shamrock, paddys, irish, shirts, holiday, clover, tops. Use clear fonts and simple iconography. Avoid trademarks."
B0DYYKDW26,Cheers Fuckers St Patricks Day Funny Beer Drinking Trump T-Shirt,https://www.amazon.com/Cheers-Fuckers-Patricks-Drinking-Trump/dp/B0DYYKDW26/ref=zg_bs_g_9056987011_d_sccl_30/134-0223989-8979526,30,https://www.amazon.com/Best-Sellers-Men%27s-Novelty-T-Shirts/zgbs/fashion/9056987011,1,2026-03-08T06:26:51.964515Z,"cheers, fuckers, patricks, day, beer, drinking, trump","Create an original, text-forward T-shirt design around: cheers, fuckers, patricks, day, beer, drinking, trump. Use clear fonts and simple iconography. Avoid trademarks."
