asin,title,link,current_rank,category_url,days_seen,first_seen,keywords,idea_prompt
B07PHVPNL1,Norge Flag Norway Norwegian Home Love Family T-Shirt,https://www.amazon.com/Norge-T-Shirt-Norway-Norwegian-Shirt/dp/B07PHVPNL1/ref=zg_bs_g_9056987011_d_sccl_9/139-1287731-5507723,9,https://www.amazon.com/Best-Sellers-Men%27s-Novelty-T-Shirts/zgbs/fashion/9056987011,1,2026-07-08T08:01:41.823062Z,"norge, flag, norway, norwegian, home, love, family","Create an original, text-forward T-shirt design around: norge, flag, norway, norwegian, home, love, family. Use clear fonts and simple iconography. Avoid trademarks."
B0CCS3QRSB,RAISEVERN Unisex Summer T-Shirts Crewneck Cool Short Sleeve Funny Graphic Print Top Casual Tees,https://www.amazon.com/RAISEVERN-Muscle-T-Shirt-Graphic-Festival/dp/B0CCS3QRSB/ref=zg_bs_g_9056987011_d_sccl_16/139-1287731-5507723,16,https://www.amazon.com/Best-Sellers-Men%27s-Novelty-T-Shirts/zgbs/fashion/9056987011,1,2026-07-08T08:01:41.823062Z,"raisevern, unisex, summer, shirts, crewneck, print, top, casual, tees","Create an original, text-forward T-shirt design around: raisevern, unisex, summer, shirts, crewneck, print, top, casual, tees. Use clear fonts and simple iconography. Avoid trademarks."
B08KVJLVXC,Norwegian Viking Ship Flag Boat Norway Heritage Tees T Shirts for Men and Women,https://www.amazon.com/Boat-Norwegian-Norway-Viking-T-Shirt/dp/B08KVJLVXC/ref=zg_bs_g_9056987011_d_sccl_24/139-1287731-5507723,24,https://www.amazon.com/Best-Sellers-Men%27s-Novelty-T-Shirts/zgbs/fashion/9056987011,1,2026-07-08T08:01:41.823062Z,"norwegian, viking, ship, flag, boat, norway, heritage, tees, shirts, women","Create an original, text-forward T-shirt design around: norwegian, viking, ship, flag, boat, norway, heritage, tees, shirts, women. Use clear fonts and simple iconography. Avoid trademarks."
B07XKWP47R,"Customized T-Shirt, Upload Photos, Type Text, Custom Gifts, Personalized with Your Own Design",https://www.amazon.com/Custom-Shirts-Personalized-Unisex-Cotton/dp/B07XKWP47R/ref=zg_bs_g_9056987011_d_sccl_25/139-1287731-5507723,25,https://www.amazon.com/Best-Sellers-Men%27s-Novelty-T-Shirts/zgbs/fashion/9056987011,1,2026-07-08T08:01:41.823062Z,"customized, upload, photos, type, text, custom, gifts, personalized, your, own, design","Create an original, text-forward T-shirt design around: customized, upload, photos, type, text, custom, gifts, personalized, your, own, design. Use clear fonts and simple iconography. Avoid trademarks."
B07PMDBS9F,Norway Flag World Class Soccer Jersey T-Shirt,https://www.amazon.com/Norway-Soccer-Jersey-Graphic-T-Shirt/dp/B07PMDBS9F/ref=zg_bs_g_9056987011_d_sccl_26/139-1287731-5507723,26,https://www.amazon.com/Best-Sellers-Men%27s-Novelty-T-Shirts/zgbs/fashion/9056987011,1,2026-07-08T08:01:41.823062Z,"norway, flag, world, class, soccer, jersey","Create an original, text-forward T-shirt design around: norway, flag, world, class, soccer, jersey. Use clear fonts and simple iconography. Avoid trademarks."
B0CBNTS7PH,Norway Flag For Men Women Norwegian Scandinavian Pride Norge T-Shirt,https://www.amazon.com/Norway-Flag-Norwegian-Scandinavian-Pride/dp/B0CBNTS7PH/ref=zg_bs_g_9056987011_d_sccl_27/139-1287731-5507723,27,https://www.amazon.com/Best-Sellers-Men%27s-Novelty-T-Shirts/zgbs/fashion/9056987011,1,2026-07-08T08:01:41.823062Z,"norway, flag, women, norwegian, scandinavian, pride, norge","Create an original, text-forward T-shirt design around: norway, flag, women, norwegian, scandinavian, pride, norge. Use clear fonts and simple iconography. Avoid trademarks."
B0CWGP264F,Mit & Mia Custom Bootleg Rap Tee Shirt for Boyfriend Girlfriend Custom Face Tshirt Vintage Graphic Shirt Gift Idea Birthday,https://www.amazon.com/Mit-Mia-Girlfriend-Boyfriend-Christmas/dp/B0CWGP264F/ref=zg_bs_g_9056987011_d_sccl_30/139-1287731-5507723,30,https://www.amazon.com/Best-Sellers-Men%27s-Novelty-T-Shirts/zgbs/fashion/9056987011,1,2026-07-08T08:01:41.823062Z,"mit, mia, custom, bootleg, rap, boyfriend, girlfriend, face, gift, idea, birthday","Create an original, text-forward T-shirt design around: mit, mia, custom, bootleg, rap, boyfriend, girlfriend, face, gift, idea, birthday. Use clear fonts and simple iconography. Avoid trademarks."
