asin,title,link,current_rank,category_url,days_seen,first_seen,keywords,idea_prompt
B0B9ZTP9F7,"Awesome Like My Daughter | Funny Tee Shirt, Sarcastic Saying Humor Dad Joke T-Shirt for Father Grandpa Daddy",https://www.amazon.com/Awesome-Daughter-Sarcastic-T-Shirt-Grandpa/dp/B0B9ZTP9F7/ref=zg_bs_g_9056987011_d_sccl_2/135-6106671-2242167,2,https://www.amazon.com/Best-Sellers-Men%27s-Novelty-T-Shirts/zgbs/fashion/9056987011,1,2026-06-22T11:25:31.630416Z,"awesome, like, daughter, sarcastic, saying, humor, dad, joke, father, grandpa, daddy","Create an original, text-forward T-shirt design around: awesome, like, daughter, sarcastic, saying, humor, dad, joke, father, grandpa, daddy. Use clear fonts and simple iconography. Avoid trademarks."
B09RBFWG2P,"It's not a Dad BOD, It's a Father Figure | Funny Daddy Tee Shirt, Sarcastic Saying Joke T-Shirt for Men Grandpa",https://www.amazon.com/Father-Figure-Sarcastic-T-Shirt-Grandpa/dp/B09RBFWG2P/ref=zg_bs_g_9056987011_d_sccl_20/135-6106671-2242167,20,https://www.amazon.com/Best-Sellers-Men%27s-Novelty-T-Shirts/zgbs/fashion/9056987011,1,2026-06-22T11:25:31.630416Z,"it's, not, dad, bod, father, figure, daddy, sarcastic, saying, joke, grandpa","Create an original, text-forward T-shirt design around: it's, not, dad, bod, father, figure, daddy, sarcastic, saying, joke, grandpa. Use clear fonts and simple iconography. Avoid trademarks."
B09XWG9FWX,"Grunt Style American Acid - USA Flag Graphic Tee, Patriotic Shirt - Men's Short Sleeve T-Shirt",https://www.amazon.com/Grunt-Style-American-T-Shirt-Royal/dp/B09XWG9FWX/ref=zg_bs_g_9056987011_d_sccl_21/135-6106671-2242167,21,https://www.amazon.com/Best-Sellers-Men%27s-Novelty-T-Shirts/zgbs/fashion/9056987011,1,2026-06-22T11:25:31.630416Z,"grunt, style, american, acid, usa, flag, patriotic","Create an original, text-forward T-shirt design around: grunt, style, american, acid, usa, flag, patriotic. Use clear fonts and simple iconography. Avoid trademarks."
B07CMDPWJ2,"Mens My Favorite People Call Me Grandpa Tee | Funny T Shirts, Dad Joke Apparel for Men, Cool Grandpa Short Sleeve, Soft Cotto",https://www.amazon.com/Mens-Favorite-People-Call-Grandpa/dp/B07CMDPWJ2/ref=zg_bs_g_9056987011_d_sccl_22/135-6106671-2242167,22,https://www.amazon.com/Best-Sellers-Men%27s-Novelty-T-Shirts/zgbs/fashion/9056987011,1,2026-06-22T11:25:31.630416Z,"mens, favorite, people, call, grandpa, shirts, dad, joke, soft, cotto","Create an original, text-forward T-shirt design around: mens, favorite, people, call, grandpa, shirts, dad, joke, soft, cotto. Use clear fonts and simple iconography. Avoid trademarks."
B09QH81FBP,"I Keep My Dad Jokes in a Dad-A-Base | Funny Father Tee, Grandpa ShirtDaddy Father's Day Pun Humor T-Shirt",https://www.amazon.com/Keep-Dad-Jokes-Dad-Base/dp/B09QH81FBP/ref=zg_bs_g_9056987011_d_sccl_25/135-6106671-2242167,25,https://www.amazon.com/Best-Sellers-Men%27s-Novelty-T-Shirts/zgbs/fashion/9056987011,1,2026-06-22T11:25:31.630416Z,"keep, dad, jokes, base, father, grandpa, shirtdaddy, father's, day, pun, humor","Create an original, text-forward T-shirt design around: keep, dad, jokes, base, father, grandpa, shirtdaddy, father's, day, pun, humor. Use clear fonts and simple iconography. Avoid trademarks."
B01KI9D3I8,Funny Father's Italian Mafia Puppet Movie Logo Men's Graphic Tee Shirt,https://www.amazon.com/Brisco-Brands-70X08-5000-BLK-X-Grandfather-Grandpa/dp/B01KI9D3I8/ref=zg_bs_g_9056987011_d_sccl_29/135-6106671-2242167,29,https://www.amazon.com/Best-Sellers-Men%27s-Novelty-T-Shirts/zgbs/fashion/9056987011,1,2026-06-22T11:25:31.630416Z,"father's, italian, mafia, puppet, movie, logo","Create an original, text-forward T-shirt design around: father's, italian, mafia, puppet, movie, logo. Use clear fonts and simple iconography. Avoid trademarks."
